trial_id,timestamp,machine_name,gpu_info,gpu_memory,platform,model,trial,latency_s,completion_tokens,tokens_per_sec,unique,duplicate_reason,sample_output
google/gemma-3-1b_1_1759005783,2025-09-27T16:43:03.185028,MSI-Laptop-4050,NVIDIA GeForce RTX 4050 Laptop GPU,6141MB,Windows-11-10.0.26100-SP0,google/gemma-3-1b,1,11.067491292953491,512,46.26161308353437,True,unique,"User: Hi, I’d like to schedule an appointment.

Agent: Certainly!  Can you tell me your name and date of birth? 

User: My name is Sarah Miller, and my birthday is January 15th, 1988.

Agent: Thank you, Ms. Miller. And what type of appointment are you looking for – primary care, specialist, something else?

User: I’d like to see a general check-up, just to get the ball rolling.  I’ve been feeling a little under the weather lately.

Agent: Okay, a general check-up is perfect. And what’s your insu"
google/gemma-3-1b_2_1759005801,2025-09-27T16:43:21.663148,MSI-Laptop-4050,NVIDIA GeForce RTX 4050 Laptop GPU,6141MB,Windows-11-10.0.26100-SP0,google/gemma-3-1b,2,15.194002628326416,512,33.69750634671278,False,semantic_similarity_0.947,"User: Hi, I’d like to schedule an appointment.

Agent: Certainly! To help me find a time that works for you, could you tell me what type of appointment you need? Are you here for anything specific, like a check-up, physical therapy, or something else?

User: It's just a routine check-up – I’ve been feeling a little tired lately.

Agent: Okay, a routine check-up.  Let me see what availability we have… We have openings on Tuesdays and Thursdays at 2 PM and 4 PM. Would either of those work for you?"
