trial_id,timestamp,machine_name,gpu_info,gpu_memory,platform,model,trial,latency_s,completion_tokens,tokens_per_sec,unique,duplicate_reason,sample_output
google/gemma-3-1b_1_1759005611,2025-09-27T16:40:11.829263,MSI-Laptop-4050,NVIDIA GeForce RTX 4050 Laptop GPU,6141MB,Windows-11-10.0.26100-SP0,google/gemma-3-1b,1,8.209791421890259,512,62.36455638018083,True,unique,"User: Hi, I’d like to schedule an appointment with Dr. Lee.

Agent: Certainly! Let me check availability for you.  Could you tell me a little bit about what you're looking for? 

User: Well, I have a persistent cough and a slight headache. I was hoping to get it checked out.

Agent: Okay, a persistent cough and headache. That’s helpful. Do you have any specific dates in mind that would work for you? 

User:  I was thinking maybe sometime next week, perhaps Tuesday or Wednesday?

Agent: Let me ch"
